{
  "task_shape": "single-pass",
  "model_mode": "single",
  "readiness": "executable",
  "reason": "Single model direct execution for bounded single-pass task",
  "topology": {
    "type": "single-session",
    "concurrency": 1
  },
  "execution": {
    "model": "model-alpha",
    "effort": "high",
    "context": "current-session"
  },
  "review": {
    "strategy": "self-check",
    "model": "model-alpha",
    "effort": "high",
    "context": "current-session"
  }
}
